{
  "probe_id": "PROBE-DATA-PRIMITIVES-001",
  "title": "Preserving data meaning across system boundaries",
  "domain": "Enterprise data contracts",
  "question": "How would you preserve the meaning of identifiers, instants, civil dates, exact scientific quantities, units, and source lineage from ingress DTO through PostgreSQL storage and downstream events?",
  "why_it_matters": "Primitive choices become durable system behavior. A strong design keeps validation, typing, database constraints, migration behavior, serialization, and scientific interpretation aligned.",
  "population_cartographies": [
    "executive",
    "evaluator",
    "scientist",
    "engineer",
    "ai_collaborator"
  ],
  "proficiency_levels": [
    {
      "level": 1,
      "focus": "Name semantic roles",
      "demonstration": "Classify a PAN as an identifier, a measurement as an exact quantity, an occurrence as an instant, and a birthday as a civil date.",
      "evidence": "The explanation connects each semantic role to the operations the value supports.",
      "repair_prompt": "Restate the value's meaning and list the valid operations before selecting a physical type."
    },
    {
      "level": 2,
      "focus": "Trace one value end to end",
      "demonstration": "Trace an occurrence instant through parsing, timezone-aware application typing, RFC 3339 interchange, and PostgreSQL timestamptz storage.",
      "evidence": "Round-trip tests preserve the same instant across timezone offsets and serialization boundaries.",
      "repair_prompt": "Add the missing boundary type or round-trip assertion and repeat the trace."
    },
    {
      "level": 3,
      "focus": "Preserve scientific interpretation",
      "demonstration": "Store source and canonical quantities with exact decimals, unit vocabulary, method revision, rounding mode, and conversion provenance.",
      "evidence": "Fixtures cover reference intervals, below-limit qualifiers, precision edges, and unit conversion replay.",
      "repair_prompt": "Bind the quantity to its unit, method, numeric profile, and source representation."
    },
    {
      "level": 4,
      "focus": "Evolve a live schema",
      "demonstration": "Implement an expand-and-contract Flyway migration and validate it against an ephemeral PostgreSQL database before application release.",
      "evidence": "Upgrade, application compatibility, reconciliation, and restore tests pass from every supported baseline.",
      "repair_prompt": "Reduce the change to additive expansion, observable transition, and a later compatibility-driven contraction."
    },
    {
      "level": 5,
      "focus": "Review the complete contract",
      "demonstration": "Challenge tenant keys, nullability, precision, vocabulary drift, clock semantics, lineage, indexing, retention, and downstream event compatibility.",
      "evidence": "The review links each material finding to a concrete schema element, target representation, test, and migration identifier.",
      "repair_prompt": "Remove speculative controls and keep the findings that change correctness, operability, or scientific meaning."
    }
  ],
  "technical_core": [
    "Semantic types guide DTO, application, database, and event representations.",
    "Native database constraints preserve meaning close to persisted state.",
    "Flyway and ephemeral PostgreSQL tests provide established migration mechanics and verification.",
    "Source values, canonical values, units, method revisions, and conversion provenance travel together."
  ],
  "review_surfaces": [
    "Ingress validation and DTO typing",
    "PostgreSQL columns and constraints",
    "Flyway compatibility sequence",
    "Serialization and event envelopes",
    "Scientific quantity and lineage tests"
  ],
  "scenario_ids": [
    "SCENARIO-DATA-PRIMITIVE-ROUNDTRIP-001"
  ],
  "claim_ids": [
    "CLAIM-NATIVE-PRIMITIVES-PRESERVE-MEANING-001"
  ],
  "instruction_yield": [
    "Classify each value by meaning and valid operations before selecting a storage primitive.",
    "Trace materially important fields through validation, typing, storage, migration, serialization, and tests.",
    "Use Flyway and ephemeral PostgreSQL instances for migration execution and compatibility verification."
  ],
  "code_comment_markers": [
    "TARGET",
    "CONTRAST",
    "GUARD"
  ],
  "settlement_status": "review_ready",
  "metadata": {
    "schema_version": "3.0.0",
    "created_at": "2026-08-04T20:00:00Z",
    "updated_at": "2026-08-04T20:00:00Z"
  }
}
